{
  "schema_version": 1,
  "feature_id": "REPLACE_ME",
  "candidate_fingerprint": "REPLACE_ME_SHA256",
  "quality_bar_id": "REPLACE_ME_QUALITY_BAR_ID",
  "quality_bar_sha256": "REPLACE_ME_SHA256",
  "verdict": "candidate_wins",
  "largest_gap": null,
  "critical_anomaly": null,
  "evidence_refs": ["REPLACE_ME_ARTIFACT_OR_OBSERVATION"],
  "confidence": "high",
  "created_at": "REPLACE_ME_ISO_TIMESTAMP"
}
